uid,title,abstract,primary_author,authors,affiliation,bio,web_link,session,yt_id,thumbnail_link,channel_name,channel_url,release_consent
356,Hindustronic Live,"During the pandemic lockdown, musicians Carlos Guedes and Kaustuv Ganguli started testing online music making software to check which technologies were (still) around and engaged in a project involving colleagues and students from NYU Abu Dhabi called Hin",Carlos Guedes,Carlos Guedes,NYU Abu Dhabi,"Carlos Guedes has a multifaceted activity in composition and sound design counting numerous commissioned projects for dance, theatrical performance, film, and interactive installations besides conventional concert music. He counts more than 80 premieres internationally, having presented work in places such as Expo’98, Expo 2020, European Capital of Culture 2001 and 2012, ArCo, De Waag, Ars Electronica, ICMC, SMC, SIGGPRAH, Judson Church, Shangai eArts, The Kitchen, National Theater S. João, Casa da Música, Beijing Modern Music Festival, and Asia Culture Center. His music is eclectic, combining influences that range from industrial to carnatic music, from western erudite traditions to trans-cultural free improvisation, always using computational technologies as tools for further expanding musical expression.
 
 Guedes also develops a parallel activity as a researcher, focusing on the development of generative computational technologies for music performance, composition, and improvisation. He is one of the founders of the Music and Sound Cultures (MaSC) research group at NYU Abu Dhabi, a group that develops hybrid methodologies blending computational and humanistic approaches for the understanding of the music from the Gulf, East Africa, and South India. Home to several funded projects that develop their research agenda, a central aspect to the group’s activities is the development of novel computational tools (such as VR environments and games) for promoting interaction and enculturation with music from this region.
 
 Carlos Guedes holds a PhD (2005) and MA (1996) in composition from New York University and a BM (1993) from ESMAE-IPP (Porto, Portugal). He is currently Associate Professor of Music and Affiliated Associate Professor in Computer Engineering at New York University Abu Dhabi and Affiliated Associate Professor of Music in Music Technology at NYU Steinhardt.",,1,,,,,
357,Feeling by Numbers,"n.b the primary format for this piece is in video, I have only uploaded the audio due to the 100MB restriction on the upload size 
 
 This piece explores the sonification of deepface imaging data. This open-source ML Python library is able to score the emot",Joshua J Gardner,Joshua J Gardner,University of Manchester,,,1,,,,,
359,Recurrent Variations for String Orchestra,"Hendrik Vincent Koops’ Recurrent Variations for String Orchestra are a set of variations for String Orchestra, created with generative audio machine learning models. It is based on his submission to ISMIR 2021, where he presented a String Quartet piece fo",Hendrik Vincent Koops,Hendrik Vincent Koops,RTL Netherlands,"Hendrik Vincent Koops is a composer and Senior Data Scientist at RTL Netherlands. He received a B.A. degree with Honors in Audio and Sound Design, and a M.A. degree in Music Composition in 2008, both at the HKU University of the Arts Utrecht. In 2012 he received a B.S. degree in Cognitive Artificial Intelligence and in 2014 the M.S. degree in Artificial Intelligence at Utrecht University. After completing research at the Department of Electrical and Computer Engineering at Carnegie Mellon University, he received a Ph.D. degree in Computer Science from Utrecht University in 2019, where he studied the computational modelling of variance in musical harmony. At RTL Netherlands, he is responsible for developing scalable audiovisual machine learning solutions to make video content more discoverable, searchable, and valuable. Hendrik Vincent Koops was a guest editor for a special issue on AI and Musical Creativity at the Transactions of the International Society for Music Information Retrieval, which focuses on new research developments in the domain of artificial intelligence applied to modelling and creating music in a variety of styles. In addition to his industry and academic work, Hendrik Vincent Koops is active as a composer, his music has received airplay on numerous local and international platforms, including part of selected and nominated works at international film festivals. He is also a co-organizer of the AI Song Contest, an international competition exploring the use of AI in the songwriting process.",,1,,"Author image: https://images.squarespace-cdn.com/content/v1/6085dfb8c720c07d1517eaaf/1620250978023-FEA5BQ4I0RRKPCN41RVJ/IMG_1746.jpeg
 Artwork: https://drive.google.com/file/d/1BJe6UPxCkLcVPKVpNg178Aog3xV5Tj2E/view?usp=sharing",,,
